{
  "$schema": "http://json-schema.org/draft-06/schema#",
  "title": "EEBUS device summary schema",
  "$ref": "#/definitions/root",
  "definitions": {
    "root": {
      "type": "object",
      "additionalProperties": false,
      "properties": {
        "product": {
          "type": "string",
          "description": "Product or service name"
        },
        "updated": {
          "type": "string",
          "description": "The date DD.MM.YYYY the provided data was gathered"
        },
        "files": {
          "type": "object",
          "additionalProperties": false,
          "description": "Filenames for the source EEBUS SPINE data",
          "properties": {
            "discovery": {
              "type": "string",
              "description": "The filename of the NodeManagementDetailedDiscoveryData response content"
            },
            "usecase": {
              "type": "string",
              "description": "The filename of the NodeManagementUseCaseData response content"
            }
          }
        },
        "versions": {
          "type": "object",
          "additionalProperties": false,
          "properties": {
            "firmware": {
              "type": "string",
              "description": "The version of the devices firmware or service that was used to gather the data"
            },
            "ship": {
              "type": "string",
              "description": "The SHIP version that is supported"
            },
            "spine": {
              "type": "string",
              "description": "The SPINE version that is supported"
            }
          }
        },
        "devicetype": {
          "type": "string",
          "description": "The 'devicetype' that is being reported in 'NodeManagementDetailedDiscoveryData'"
        },
        "iscem": {
          "type": "boolean",
          "description": "Set to 'true' if the device is a energy management system"
        },
        "usecases": {
          "type": "array",
          "items": {
            "type": "object",
            "additionalProperties": false,
            "properties": {
              "name": {
                "type": "string",
                "description": "The usecase 'name' value of the supported use case defined in 'usecases.json'"
              },
              "version": {
                "type": "string",
                "description": "The version of the use case reported as being supported"
              },
              "invalid": {
                "type": "boolean",
                "description": "Set to 'false' if the use case is reported as being supported but is not implemented"
              },
              "scenarios": {
                "type": "array",
                "description": "A list of the supported scenarios",
                "items": {
                  "type": "object",
                  "additionalProperties": false,
                  "properties": {
                    "id": {
                      "type": "integer",
                      "description": "The scenario ID as defined in the use case"
                    },
                    "invalid": {
                      "type": "boolean",
                      "description": "Set to 'false' if the scenario is reported as being supported but is not implemented"
                    }
                  },
                  "required": ["id"]
                }
              },
              "actor": {
                "$ref": "#/definitions/actor",
                "description": "The actor reported by the device for this use case"
              },
              "correctedactor": {
                "$ref": "#/definitions/actor",
                "description": "If the reported actor is invalid, this contains the actor it should have instead"
              },
              "entityid": {
                "type": "array",
                "description": "The SPINE entity ID array this use case & actor is implemented in",
                "items": {
                  "type": "integer",
                  "description": "The SPINE entity ID"
                }
              },
              "notes": {
                "type": "string",
                "description": "Additional notes, findings about the use case and its scenarios"
              }
            },
            "required": ["name", "version", "scenarios"]
          }
        },
        "features": {
          "type": "array",
          "items": {
            "type": "object",
            "additionalProperties": false,
            "properties": {
              "entityid": {
                "type": "array",
                "description": "The SPINE entity ID array these features are implemented in",
                "items": {
                  "type": "integer",
                  "description": "The SPINE entity ID"
                }
              },
              "entitytype": {
                "type": "string",                    
                "description": "The SPINE entity type this feature is supported by",
                "enum": ["CEM", "EVSE", "EV", 
                  "ElectricityStorageSystem", 
                  "GridConnectionPointOfPremises", "BatterySystem",
                  "ElectricityGenerationSystem", "PVSystem",
                  "HeatPumpAppliance", "Generic"]
              },
              "role": {
                "type": "string",
                "description": "The feature role",
                "enum": ["server", "client"]
              },
              "features": {
                "type": "array",
                "items": {
                  "type": "object",
                  "additionalProperties": false,
                  "properties": {
                    "type": {
                      "type": "string",
                      "description": "The SPINE feature type"
                    },
                    "invalid": {
                      "type": "boolean",
                      "description": "Set to 'false' if the feature is reported as being supported but is not implemented"
                    }
                  }
                }
              },
              "notes": {
                "type": "string",
                "description": "Additional notes, findings about the entities features"
              }
            }
          }
        },
        "notes": {
          "type": "string",
          "description": "Additional notes, findings about the device"
        }
      },
      "required": ["product", "updated", "files", "versions"]
    },
    "actor": {
      "type": "string",
      "enum": [
        "Battery",
        "BatterySystem",
        "CEM",
        "ConfigurationAppliance",
        "Compressor",
        "ControllableSystem",
        "DHWCircuit",
        "EnergyGuard",
        "EnergyBroker",
        "EnergyConsumer",
        "EVSE",
        "EV",
        "GridConnectionPoint",
        "HeatPump",
        "HeatingCircuit",
        "HeatingZone",
        "HVACRoom",
        "Inverter",
        "MonitoredUnit",
        "MonitoringAppliance",
        "OutdoorTemperatureSensor",
        "PVString",
        "PVSystem",
        "VisualizationAppliance"
      ]
    }
  }
}
