{
  "product": "Elli Connect / Pro",
  "updated": "12.04.2023",
  "files": {
    "discovery": "discovery-data.json",
    "usecase": "usecase-data.json"
  },
  "versions": {
    "firmware": "v3.8.12",
    "ship": "1.0",
    "spine": "1.3.0"
  },
  "devicetype": "Generic",
  "usecases": [
    {
      "name": "evseCommissioningAndConfiguration",
      "version": "1.0.1",
      "scenarios": [
        {
          "id": 1
        },
        {
          "id": 2
        }
      ],
      "actor": "EVSE"
    },
    {
      "name": "evCommissioningAndConfiguration",
      "version": "1.0.1",
      "scenarios": [
        {
          "id": 1
        },
        {
          "id": 2
        },
        {
          "id": 3,
          "invalid": true
        },
        {
          "id": 4,
          "invalid": true
        },
        {
          "id": 5,
          "invalid": true
        },
        {
          "id": 6,
          "invalid": true
        },
        {
          "id": 7,
          "invalid": true
        },
        {
          "id": 8
        }
      ],
      "actor": "EV",
      "notes": "Only the scenarios \"EV connected\", \"EV sends communication standard\" and \"EV disconnected\" are really supported. All other scenarios require the EV to communicate via ISO15118 with the EVSE, which this device is not capable of."
    },
    {
      "name": "measurementOfElectricityDuringEvCharging",
      "version": "1.0.1",
      "scenarios": [
        {
          "id": 1
        },
        {
          "id": 2,
          "invalid": true
        },
        {
          "id": 3,
          "invalid": true
        }
      ],
      "actor": "EV",
      "notes": "The Elli Charger Connect does not contain a meter. For that model the provided measurements are only assumptions. Also only the scenario \"Measure EV charging current\" is really supported."
    },
    {
      "name": "overloadProtectionByEvChargingCurrentCurtailment",
      "version": "1.0.1",
      "scenarios": [
        {
          "id": 1
        },
        {
          "id": 2
        },
        {
          "id": 3
        }
      ],
      "actor": "EV"
    },
    {
      "name": "optimizationOfSelfConsumptionDuringEvCharging",
      "version": "1.0.1",
      "scenarios": [
        {
          "id": 1
        },
        {
          "id": 2
        },
        {
          "id": 3
        }
      ],
      "actor": "EV",
      "notes": "Self consumption information from the HEMS is transformed into overload protection values."
    },
    {
      "name": "coordinatedEvCharging",
      "version": "1.0.1",
      "invalid": true,
      "scenarios": [
        {
          "id": 1,
          "invalid": true
        },
        {
          "id": 2,
          "invalid": true
        },
        {
          "id": 3,
          "invalid": true
        },
        {
          "id": 4,
          "invalid": true
        },
        {
          "id": 5,
          "invalid": true
        },
        {
          "id": 6,
          "invalid": true
        },
        {
          "id": 7,
          "invalid": true
        },
        {
          "id": 8,
          "invalid": true
        }
      ],
      "actor": "EV",
      "notes": "This use case is reported as being available, but it is not. The use case requires the EV to communicate via ISO15118, which this device is not capable of."
    },
    {
      "name": "evChargingSummary",
      "version": "1.0.1",
      "invalid": true,
      "scenarios": [
        {
          "id": 1,
          "invalid": true
        }
      ],
      "actor": "EV",
      "notes": "This is use case is reported as being available, but not implemented."
    }
  ],
  "features": [
    {
      "entitytype": "EVSE",
      "entityid": [
        1
      ],
      "role": "server",
      "features": [
        {
          "type": "DeviceClassification"
        },
        {
          "type": "Bill",
          "invalid": true
        },
        {
          "type": "DeviceDiagnosis"
        }
      ],
      "notes": "This \"Bill\" feature is not implemented."
    },
    {
      "entitytype": "EV",
      "entityid": [
        1,
        1
      ],
      "role": "server",
      "features": [
        {
          "type": "DeviceClassification"
        },
        {
          "type": "DeviceDiagnosis"
        },
        {
          "type": "ElectricalConnection"
        },
        {
          "type": "LoadControl"
        },
        {
          "type": "Measurement"
        },
        {
          "type": "DeviceConfiguration"
        },
        {
          "type": "TimeSeries",
          "invalid": true
        },
        {
          "type": "IncentiveTable",
          "invalid": true
        },
        {
          "type": "Identification",
          "invalid": true
        }
      ],
      "notes": "The features \"TimeSeries\", \"IncentiveTable\", and \"Identification\" require the EV to communicate via ISO15118, which this device is not capable of. These features are not implemented."
    },
    {
      "entitytype": "EV",
      "entityid": [
        1,
        1
      ],
      "role": "client",
      "features": [
        {
          "type": "Generic"
        }
      ]
    }
  ]
}